{
  "contract": "ai-sow-delivery-bundle-v1",
  "inputRevisionId": "000001",
  "scopeSha256": "9111111111111111111111111111111111111111111111111111111111111111",
  "stories": [
    {
      "storyId": "story-refund-processing",
      "featureIds": ["feature-refund-processing"],
      "storyType": "IMPLEMENTATION",
      "name": "完成退款申请处理",
      "description": "用户能够提交有效退款申请并查看处理状态。",
      "uatRelevant": true
    }
  ],
  "acceptanceCriteria": [
    {
      "acceptanceCriterionId": "ac-refund-submit",
      "storyId": "story-refund-processing",
      "sequence": 1,
      "name": "有效退款申请被受理并返回可追踪编号",
      "rationale": "该结果直接证明退款申请处理能力可用。"
    }
  ],
  "tasks": [
    {
      "taskId": "task-refund-service",
      "storyId": "story-refund-processing",
      "taskKind": "IMPLEMENTATION",
      "name": "实现退款申请服务",
      "baseUnit": "BU-BUSINESS-SERVICE-API",
      "workMode": "新建",
      "workModeRationale": "Greenfield 项目不存在可复用的退款申请服务。",
      "complexity": "M",
      "acceptanceCriterionIds": ["ac-refund-submit"],
      "designItemIds": ["design-item-refund-service"],
      "integrationIds": [],
      "nfrIds": [],
      "dependsOnTaskIds": [],
      "rationale": "按一个独立退款服务接口实例计价。"
    }
  ],
  "dependencies": []
}
