{
  "contract": "ai-sow-delivery-bundle-v1",
  "inputRevisionId": "000001",
  "scopeSha256": "1333333333333333333333333333333333333333333333333333333333333333",
  "stories": [
    {
      "storyId": "story-refund-processing",
      "featureIds": ["feature-refund-processing", "feature-refund-notification"],
      "storyType": "IMPLEMENTATION",
      "name": "完成退款自动审核与状态通知",
      "description": "退款申请自动审核后完成支付退款并向用户呈现一致状态。",
      "uatRelevant": true
    }
  ],
  "acceptanceCriteria": [
    {
      "acceptanceCriterionId": "ac-refund-result",
      "storyId": "story-refund-processing",
      "sequence": 1,
      "name": "通过审核的退款获得支付结果和用户通知",
      "rationale": "该结果共同证明退款处理与通知 Feature 已完成。"
    }
  ],
  "tasks": [
    {
      "taskId": "task-refund-recovery-design",
      "storyId": "story-refund-processing",
      "taskKind": "DESIGN",
      "name": "设计退款流程恢复目标与方案",
      "baseUnit": "BU-ARCHITECTURE-DESIGN",
      "workMode": "新建",
      "workModeRationale": "往期 SOW 未包含退款流程恢复目标设计。",
      "complexity": "M",
      "acceptanceCriterionIds": ["ac-refund-result"],
      "designItemIds": ["design-item-refund-orchestration"],
      "integrationIds": [],
      "nfrIds": ["nfr-recovery-objective"],
      "dependsOnTaskIds": [],
      "rationale": "以一项待明确恢复目标的方案设计实例计价。"
    },
    {
      "taskId": "task-refund-orchestration",
      "storyId": "story-refund-processing",
      "taskKind": "IMPLEMENTATION",
      "name": "调整退款编排流程",
      "baseUnit": "BU-BUSINESS-SERVICE-API",
      "workMode": "调整",
      "workModeRationale": "在既有退款接口基础上调整退款编排流程。",
      "workModeEvidence": {
        "effectiveStartItemId": "effective-start-refund-api",
        "effectiveStartItemName": "既有退款接口"
      },
      "complexity": "M",
      "acceptanceCriterionIds": ["ac-refund-result"],
      "designItemIds": ["design-item-refund-orchestration"],
      "integrationIds": [],
      "nfrIds": ["nfr-recovery-objective"],
      "dependsOnTaskIds": ["task-payment-refund-integration"],
      "matchedEffectiveStartItemId": "effective-start-refund-api",
      "rationale": "按一个既有退款业务操作调整实例计价。"
    },
    {
      "taskId": "task-payment-refund-integration",
      "storyId": "story-refund-processing",
      "taskKind": "IMPLEMENTATION",
      "name": "接入支付平台退款接口",
      "baseUnit": "BU-EXTERNAL-INTEGRATION",
      "workMode": "新建",
      "workModeRationale": "本期首次交付支付平台退款集成。",
      "complexity": "M",
      "acceptanceCriterionIds": ["ac-refund-result"],
      "designItemIds": ["design-item-refund-orchestration"],
      "integrationIds": ["integration-payment-refund"],
      "nfrIds": ["nfr-recovery-objective"],
      "dependsOnTaskIds": ["task-refund-recovery-design"],
      "rationale": "按一个外部支付平台退款对接实例计价。"
    }
  ],
  "dependencies": [
    {
      "dependencyId": "dependency-recovery-before-build",
      "predecessorTaskId": "task-refund-recovery-design",
      "successorTaskId": "task-payment-refund-integration",
      "rationale": "接入实现前必须明确恢复目标和设计边界。"
    },
    {
      "dependencyId": "dependency-integration-before-orchestration",
      "predecessorTaskId": "task-payment-refund-integration",
      "successorTaskId": "task-refund-orchestration",
      "rationale": "退款编排完成前必须具备支付平台退款对接。"
    }
  ]
}
